text,label
в ходе мониторинга событий иб зафиксировано аномальное поведение ресурсов  skzs upstream gazprom-neft ru  в рамках процесса мониторинга дефейса сайтов  при переходе на ресурсы происходит редирект на  id upstream gazprom-neft ru,3
сервис эра-кс ошибка эра кс  график в статусе планирование не переходит в статус согласование подрядчик талспецстрой объект куст скважин № 213 изм 2,1
для следующих учётных записей был запрошен доступ специалиста технической поддержки в арм аккредитации  sukhov va@gazprom-neft ru abzalatinov vr@gazprom-nef ru polevoy nm@gazprom-neft ru,2
отсутствует доступ к экосистеме брд при вводе 6-значного кода из приложения отказано в доступе прошу помощи с авторизацией,1
eraks-3462 новый пользователь  прошу предоставить данные об уз vasilev-ma@gtm ooo для дальнейшего определения доступа к данным,2
при входе в эракс не отображаются текущие договоры в связи с этим нет возможности подать своду,2
обращение в helpdesk №54  пользователь vasilev-ma@gtm ooo обратился с проблемой по проекту личный кабинет  добрый день не видно текущих договоров в системе эракс,2
прошу согласовать заявки на доступ к витрине вызовов  №74369 и №74370,2
бк пароль при попытке авторизации пишет что неверный логин или пароль  а при попытке восстановить пароль ошибка,2
в эко-системе неверный код аутентификатора,1
регистрация в брд витрина вызовов  профиль - производство рефрижераторных контейнеров ремонт промышленного холодильного оборудования производство мобильных зданий,2
новая скважина западно-таркосалинское куст 3 скважина 1306,2
появилась массовая проблема с синхронизацией  с разных до обращаются по данной проблеме,1
просьба проконсультировать пользователя по проблеме со входом в экосистему брд,1
эра бурения проблема с входом в экосистему_ооо техгеобур просьба проконсультировать пользователя по проблеме со входом в экосистему брд,1
на проде наблюдается проблема с пробросом запросов на plan-approval-ms-main,2
описание обращения  прошу обновить базовый образ • plan-purchreport-ui-main • plan-purchreport-ms-main,2
прошу предоставить данные по уз  kirill210399@mail ru,2
прошу проверить права доступа в смб 2 0 учетной записи gpnz-sp12pngkm@gazprom-neft ru  пароль xxx321456xxx%%%  т к  не можем зайти через свою учетную запись  так же с сегодняшнего дня наблюдается сбой связи  нет интернета,1
на сегодняшний день так и не получена учётная запись для доступа в экосистему брд  первая заявка подана 28 06 2024 – не исполнена  повторная заявка подана через суид с 11 07 2024 – не исполнена  прошу содействия в скорейшем получении,2
прошу проверить права доступа в смб 2 0 учетной записи gpnz-sp12pngkm@gazprom-neft ru,2
проверить регистрацию платинуса - такое ощущение будто она задвоилась - см  скрин  посмотрите не заведен ли у нас ошибочно платинус два раза,3
доступ в экосистему  подскажите пожалуйста  зарегистрировался в брд есть учётная запись пароль но не могу войти  в чем может быть проблема,2
просьба создать планируемую скважину  западно-таркосалинское куст 3 скважина 1306  отсутствует в эра  бурение ,2
поменял телефон не получается войти в личный кабинет просит код яндекс ключ  как мне восстановить доступ  спасибо,2
прошу добавить пользователя в cradle системы luna-park email asz_zakupkigazprom-neft ru остальные данные скопировать с пользователя plz_init@gazprom-neft ru,2
сервис уведомлений бк  запись product catalog -> product_offering,3
о подключении к брд ооо «гпн - развитие» работников ао стнг см прил,2
экосистема брд подскажите пожалуйста причины отклонения  что вообще требуется сделать  регистрировались согласно инструкции,3
у меня проблемы со входом в приложение пишетчто моя учетная запись деактивирована  подскажите пожалуйста как можно решить данную проблему,1
прошу открепить от аккаунта  почта a shemetov@cgb burgaz ru  двухэтапную аутентификацию по причине отсутствия доступа к устройству на котором находилось приложение яндекс ключ,2
бк регистрация есть проблема на стенде uat  кспд   не отображается профиль пользователя   см прил,2
скзс выгрузка прошу направить выгрузку по пользователям экосистемы на текущую дату,3
бк ошибка возникла проблема при входе в эко систему  прошу вас помочь в решении данного вопроса  интернет соединения есть!,1
servicecall close № 875975  tier2 8  ошибка при входе в эра бурение,1
бк регистрация пользователя заявка №33022 регистрация в сервисе витрина вызовов газпром нефть прошел регистрацию,1
ошибка при входе в эра бурение,2
