text,label
регистрация организации   просим внести компанию ооо нпо роботех инн 5948069281  компания является производителем насосов и комплектующих к ним  карточка компании во вложении,2
регистрация организации   мы хотим зарегистрироваться на вашей платформе  действующих договоров с гпн у нас нет  компания занимается разработкой программного обеспечения для нефтяной промышленности с помощью ии,2
обращение от bid   газпром бизнес id  l3   № bs-00141  ошибка отправки писем на тп,1
регистрация организации   не нашел нашу компанию с списке организаций прошу добавить  направляю информацию в соответствии с требованиями изложенными в инструкции,2
ошибка в экосистеме брд   при переходе по ссылке с номером заявки 73839 экосистема выдает ошибку,2
бк   доработка   при подписке на витрину вызовов возникает ошибка при выборе всех до необходимо исключить лишние до так как выбор до не влияет на доступный функционал в сервисе,2
обращение от bid   газпром бизнес id  l3   № bs-00139  переход в пик по долгому пути с повторной авторизацией,3
обращение от bid   газпром бизнес id  l3   № bs-00138  при подтверждении эл почты открывается окно для повторного направления ссылки,2
обращение от bid   газпром бизнес id  l3   № bs-00137  под ролью куратор не работает переход в брд,3
обращение по сервису эра-бурение   требуется проверить доступ учетной записи сотрудника подрядной организации ооо «итс» озоль максим антонович к формированию программы бурения,1
ошибка в сервисе тех  авангард   та_баг,2
выгрузка тех  авангард   та_дата выгрузки не соответствует календарной,2
ошибка в экосистеме брд   недоступна витрина вызовов,1
бк   ошибка назначения куратора   витрина вызовов гпн,1
ошибка в экосистеме брд   при принятии в работу заявки на добавление нового сервиса администратором лк – ошибка 500,2
обращение по эра-бурение   быстродействие сервисов бк релиз 4,1
ошибка в системе брд   при принятии в работу заявки на добавление нового сервиса администратором лк – ошибка 500,2
ошибка в isource   не работает сервис уведомлений на проде есть ошибка при отправке уведомлений,2
бк   ошибка назначения куратора   после согласования заявки на регистрацию уз в организации не имеющей заявка переходит в статус «отклонено контрагентом»,1
ошибка в витрине вызовов   проблема в работе витрины вызовов,1
бк ограничение доступа смб2 0_отозвать доступ у пользователя причина – закончен договор с по,2
чистка бк   гпн-восток   по запросу конюхова в а   в копии  прошу отозвать подписку на каскад pdm от гпн-восток у «югранефтегазпроект»  саляева лиана ильшатовна,3
ошибка в экосистеме брд   ошибка 500 при согласовании подписки от иб - l3,1
fw     external   вход в экосистему блока разведки и добычи,1
fw     external   vr concept регистрации в витрине вызовов,2
бк qr  регистрация эра бурения,2
fw  eraks-3647 новый пользователь,2
бк   консультация   задача 444,3
бк   консультация   портал эра бурение,1
fw  eraks-3644  новый пользователь,2
fw  согласование заявки на подписку на сервис,1
бк   консультация   fw  доступ пользователя суид,3
fw  газпром бизнес id  l3   № bs-00253  ошибка при переходе в лк,2
бк   консультация   эра,1
бк   консультация   проблема с синхронизацией,1
бк   консультация   заявка №74535 на подписку на сервис  согласовано иб,1
доступ в систему бизнес-коннектор,3
бк   консультация   экобрд цп пб консультация по периметру,3
бк   консультация   экобрд скзс вопросы про компанию,3
экобрд смартсервис уточняющие вопросы,3
эра-капитальное строительство   ошибка   ошибка 403 от 08 08 2024 г,1
согласование заявки на подписку на сервис,1
бк  консультация   ошибка подписки на сервис,2
скзс   выгрузка   выгрузка пользователей экосистемы,3
бк   корректировка в ауз   экосистема брд  некорректно работает ис «экосистема брд» не вижу заявки,1
бк   консультация   контакт претендента,3
бк   регистрация организации   регистрация в витрине вызовов,2
смб 2 0   консультация   проблема с синхронизацией,1
сервис эра-бурение   ошибка   fw     external   не заходит в эра-бурение,1
bid   консультация   газпром бизнес id  l3   № bs-00252  арм аккредитации,2
сервис эра-бурения   ошибка   по работе в экосистеме брд - эра бурения,2
бк кспд,1
эра-капитальное строительство   дубликат   eraks-3521 гпн-ннг ошибка 403 при входе и ссылка на суид,1
тех авангард   быстродействие   тех авангард_медленная работа системы,2
эра-капитальное строительство   ошибка   eraks-3521 гпн-ннг ошибка 403 при входе и ссылка на суид пользователь nng@pks expert,1
бк   консультация   добро пожаловать в экосистему брд «газпром нефть»!,1
бк   ошибка   отказан доступ,2
эра-капитальное строительство   ошибка   eraks-3521 гпн-ннг ошибка 403 при входе и ссылка на суид пользователь groza15@list ru,1
бк   консультация   интеграция с бк,1
бк   консультация   пропала вкладка аналитика из личного кабинета  помогите найти,2
бк   консультация   проблемы со входом,1
эра-капитальное строительство   дубликат   eraks-3521 гпн-ннг ошибка 403 при входе и ссылка на суид  пришлите пожалуйста данные по уз groza15@list ru какая организация и подписки,2
eraks-3524 новый пользователь,2
проблема с регистрацией в экосистеме брд,2
sos_ошибки на витрине вызовов  коллеги тп прошу по этой задаче пока манипуляции не производить – решаем вопрос на уровне маппинга в приложении завтра ближе к обеду отпишусь,1
бк   ложная   регистрация ооо ювизор в витрине вызовов,3
sos_ошибки на витрине вызовов,1
sos_ошибки на витрине вызовов,1
бк   консультация   информация по компаниям - участникам нг кластера на витрине вызовов,3
газпром бизнес id  l3   № bs-00250  не работает sso для уз,1
экобрд  тех авангард   не приходят уведомления,3
учетная запись  пишет отсутствует код токен вахское 44бис_584б григорьев а с куратор кузнецов евгений юрьевич григорьев артем сергеевич нет доступа в смб 2 0,2
бк   регистрация организации   регистрация компании ооо энергаз в экосистеме витрина вызовов гк газпром нефть,2
витрина вызовов   доработка   витрина вызовов роли,3
бк сброс qr,1
газпром бизнес id  l3   № bs-00248  некорректный код еск в выгрузке,3
бк   ошибка   eraks-3523 авторизация не доходит до яндекс-ключа,1
бк   ошибка   экосистема брд  некорректно работает ис «экосистема брд» не вижу заявки,2
бк   ошибка   экосистема брд не прогружается,1
сервис эра-бурение   подписка   восстановление доступа для работы в сервисе эра- бурение,1
учетная запись,1
получение доступа к системе экосистема брд  эра бурение  микляев евгений александрович,1
бк   консультация   заявка на регистрацию в экосистеме брд «газпром нефть» №33054,2
заявка №32881 на регистрацию  принята,2
эра бурение 403 и 500 ошибки при работе через экосистему брд,1
не могу пройти двухэтапную аутентификацию,1
газпром бизнес id  l3   № bs-00248  создать новый источник ка в базе бid,3
не могу зайти в брд,2
бк   регистрация организации   запрос в регистрации организации в экосистеме брд,2
бк   дубликат   заявка на регистрацию,2
бк   консультация   каскад pdm,3
сервис каскад pdm   ошибка   отсутствие доступа в каскад pdm,1
при формировании заявки на подписку сервис «витрина вызовов» возникает ошибка,1
bid   пароль   газпром бизнес id  l3   № bs-00247  восстановление пароля,1
газпром бизнес id  l3   № bs-00246  присвоить полномочия в cradle,1
тех авангард   ошибка   тех  авангард  что случилось с доступом в тех авангард  ошибка 403  нет доступа,1
bid   дубликат   тест сценариев для демо,1
газпром бизнес id  l3   № bs-00245  присвоить полномочия в cradle,1
fw  газпром бизнес id  l3   № bs-00244  не удается перейти в лк резерв,1
bid   ошибка   газпром бизнес id  l3   № bs-00243  не работает переход в пик,2
бк   консультация   заявка №74496 на подписку на сервис  на согласовании до,2
бк   пароль   доступ к сайту экосистемы брд,1
бк   регистрация организации   регистрация,2
бк   регистрация пользователя   заявка на регистрацию,2
fw     external   вход в смб 2 0  куратор миронов н а,1
ранее были попытки регистрации в сервисе  однако письмо для подтверждения почты так и не получил  последняя попытка 15 07 2024  скрин во вложении,1
сервис эра-бурение   ошибка   учетка слетела пароль не принимает криптопро,2
бк   регистрация организации   ооо «бранд» осуществляет услуги по строительному контролю согласно договору №ннг-24 09000 00779 р от 05 07 2024 г,2
не получается подписаться на сервис «витрина вызовов»,2
сервис эра-бурение   ошибка   захожу через брд и не могу согласовать за пашкова под учеткой пашкова,2
бк   qr   добрый день необходимо скинуть qr для яндекс ключа  сделайте 16 значный код при входе если вдруг яндекс ключ скинулся или поменялся телефон,1
bid   ошибка   газпром бизнес id  l3   № bs-00239  исполнитель по заявкам указывается некорректно,3
бк   консультация   вход в эру-бурения,1
bid   ошибка   газпром бизнес id  l3   № bs-00240  статусы верификации документов при обработке заявок на повышение уровня аккредитации,3
бк   ограничение доступа   ошибка при заполнении смб 2 0,2
бк   регистрация организации   прошу оказать содействие в регистрации компании ооо нпп сибэкосорб сфу  инн 2460106232,2
бк   корректировка в ауз   смена администратора от организации ооо промконсалтинг в системе брд,2
бк   регистрация пользователя   доступ к экосистеме и сервису витрина вызовов,2
бк   дубликат   проблема с входом на портал,2
bid   keycloak   газпром бизнес id  l3   № bs-00238  сброс второго фактора аутентификации,2
скзс   выгрузка   выгрузка пользователей экосистемы,3
бк   дубликат   востановление доступа учетной запеси  куратор   миронов н а,1
бк   дубликат   востановление доступа учетной запеси  куратор   миронов н а,1
тех авангард консультация fw  та_замещение на время отсутствия н романовой,3
бк   пароль   утеря пароля,1
бк  консультация   очень срочно!!! контакт  8-982-512-89-47 братилов евгений,1
бк   корректировка в ауз   внесение правок в сервисе,3
бк   регистрация пользователя   fw     external   заявка №33132 на регистрациюцию,2
среда  uat сегмент  кспд проект тех авангард проблематика  не приходят увведомления  номер задачи  https   task gazprom-neft local browse onbesysbrd-141,2
бк   дубликат   аккредитация организации фгаоу во санкт-петербургский государственный университет,2
бк   регистрация организации   аккредитация организации фгаоу во санкт-петербургский государственный университет,2
бк выгрузка зависшие заявки компании сибитек,3
заявки на регистрацию  на верификацию,2
газпром бизнес id  l3   № bs-00236  не присвоены роли в isource процессор,2
бк   keycloak   проблема с двухэтапной аутентификацией,1
востановление доступа учетной запеси  куратор   миронов н а,1
ошибки входа в личный кабинет бк и проект неттинг,3
газпром бизнес id  l3   № bs-00235  пропали все планы ко в личном кабинете,2
бк консультация fw  экобрд   airlogic   проверка ссылок,3
бк   регистрация организации   проблема с входом на портал,2
бк   keycloak   двухфакторная аутентификация,2
бк   дубликат   согласование заявки 31103,2
доступ к системе бызов в а  ао нск,2
bid   ошибка   газпром бизнес id  l3   № bs-00228  отображение куратора в арм аккредитации,2
эра бурения на 30 07 2024 невозможности сохранить изображнения в блоках,2
газпром бизнес id  l3   № bs-00230  обновить базовый образ,2
eraks-3504,1
сервис эра-кс   консультация   эра кс прошу предоставить данные по уз  iskhakov@profftech ru,2
прошу подключиться к проблеме пользователь через экосистему брд не может перейти к сервису эра-бурение,3
не получается зайти в экосистему код который формируется в яндекс ключ не подходит  прошу помочь в решении данного вопроса,1
бк   ошибка   прошу подключиться к проблеме пользователь через экосистему брд не может перейти к сервису эра-бурение,1
бк   ошибка   пользователь сталкивается с проблемой при авторизации в экосистему брд  просьба взять данное обращение в работу,1
бк   ошибка   пользователь сталкивается с проблемой при работе через экосистему брд  запрос user-profile выдает ошибку  просьба взять данное обращение в работу,1
бк   ошибка   при вводе второго ключа  яндекс ключ  программа зависает  скрин-шот прилагаю   такое происходит уже второй час,1
бк   ошибка   пользователь сталкивается с проблемой при авторизации в экосистему брд  просьба взять данное обращение в работу,1
газпром бизнес id  l3   № bs-00227  ошибка выгрузки файла мониторинга,1
проверки наличия полномочий для пользователей согласно списку во вложении в рамках проекта u200001840 доступы были присвоены однако вход в систему асз в продуктивном контуре невозможен что стопорит работу бизнеса,1
бк   ошибка   пытаюсь зайти в экосистему брд  после ввода пароля аутентификатора страница не может прогрузиться,1
бк   ошибка   пользователь сталкивается с проблемой при работе через экосистему брд  запрос user-profile выдает ошибку,1
бк   ошибка   при попытке авторизации в зкосистеме брд происходит бесконечная загрузка некоторые запросы выдают 500,1
бк   ошибка   с сегодняшнего дня не удается произвести операции в лк экосистемы,1
учетная запись,2
бк   ошибка   со вчерашнего дня отслеживаются проблемы с доступом к системе эра бурение мониторинг  долгая загрузка страницы с последующей «внутренней ошибкой»  подскажите с чем может быть связано,2
регистрация учётной записи,2
бк   keycloak   не получается зайти в экосистему,1
предоставление доступа к личному кабинету,2
доступ к витрине вызовов,2
бк ложная проведение тех  работ в экосистеме брд  плановые работы,3
bid   корректировка в ауз   газпром бизнес id  l3   № bs-00218 добавление отчества в регистрационные данные,2
бк подписка экобрд   airlogic   просьба согласовать подписку на сервис,3
бк   регистрация организации   регистрация компании рексофт в витрине вызовов пао газпром нефть,2
бк   keycloak   доступ к экосистеме брд  яндекс ключ переустановил и нет возможности его привязать к вашему ресурсу  будет возможность его отключить или направить qr-код для активации доступа,1
бк   подписка   экобрд   airlogic  согласовать заявку,2
просьба помочь  прошу посмотреть в чем проблема у данного пользователя  николаев константин заместитель руководителя проектов по волго-уральскому региону ооо «тсс»,1
бк  консультация   обращение в helpdesk №55,3
маркетплейс   ошибка   проблемы пользователя маркетплейс,2
бк   дубликат   регистрация обращений через бк,3
заявка 33095,3
маркетплейс   дубликат   ао евракор  не могу загрузить фото,2
вход в программу смб2 0 _карамовское 24_921,1
прошу проверить наличие учетной записи в cradle по сервисному пользователю ispr-plz-adminibuat роль plz_admin_ib  для тестового контура uat  сейчас при входе ошибка 403,2
при попытке зарегистрироваться выдает что уже подана заявка если все же была подана заявка хотелось бы узнать в какие сроки будет готова,1
топливо ошибки пользователя учеткой myseva mv@gazprom-neft ru см  вложения,2
относительно заявка на регистрацию учетной записи  у меня стоит отметка отклонено конторагентом  как это можно исправить,2
прошу решить проблему со входом в экосистему  сервис эра кс  инженеру пто братилову евгению александровичу ооо «стс»логин  slavneft@stsomsk ru,2
в ходе регистрации на портале экосистемы создалось 2 аккаунта в яндекс id при входе на портал система у меня запросила 6-значный код я ошибочно удалил оба аккаунта прошу помощи для восстановления,1
