text,label
не удается восстановить пароль для входа в систему,1
не удается авторизироваться в системе смб 2 0 ранее в системе удавлось авторизироваться прошу проверить доступына сайте экосистемы авторизация проходит  логин og1974vlv@mail ru,1
bid   ошибка   газпром бизнес id  l3   № bs-00221  регистрация в экосистеме газпром бизнес id,2
bid исправление интерфейса   газпром бизнес id  l3   № bs-00224  корректировка часов работы поддержки,3
в связи с утерей уч записи в яндекс ключ нет возможности сформировать одноразовый код для входа учетную запись gip11@tps-expert ru каскад pdm  прошу проконсультировать по вариантам повторного заведения учетной записи,2
по заявке №33067 не пришло подтверждение и не можем войти в акаунт,2
bid   ошибка   газпром бизнес id  l3   № bs-00223  согласованная заявка на роль куратора не работает,2
бк корректировка в ауз просьба дать роль куратора до по сервисам смб и эра-б в гпн-развитие,1
скзс   выгрузка   направить выгрузку по пользователям экосистемы в течении дня,3
bid   keycloak   требуется сбросить второй фактор аутентификации для учетной записи p goncharov@isource ru,2
прошу предоставить данные по организации  ооо газинформсервис,2
бк ограничение доступа прошу отозвать все роли по мессояханефтегаз у сотрудников,2
не удается получить доступ в редактирование и просмотр скважин в сервисе эра-бурение необходимая подписка оформлена доступ предоставлен но программа бурения недоступна выдается ошибка 404  логин пользователя a davlytbaev@irb burgaz ru,1
заблокирован вход в ситему через ресурс восстановления пароля не дает изменить пароль- любой пароль пишет как недостойно безопасный прошу восстановить доступ,1
эра-бурение подписка просьба согласовать заявки 509 510 511 и 512 на доступ в тестовом сегменте экосистемы брд к ис “эра бурения” для пользователя друзь денис петрович email  druzden1@gmail com,2
прошу предоставить данные по уз  mmartynova@ussc ru,3
прошу предоставить данные по организации  ооо профессиональные технологии,2
заполнение программы бурения в эра  бурение,2
бк   регистрация пользователя   подключение ццс к эра бурение  уточните пожалуйста по статусу регистрации в экосистема брд и запросу ролей,2
бк   ложная   к сожалению я так и не могу зайти в свою учетку,3
прошу отозвать подписку на сервисы эра-бурение и смб 2 0 у перечисленных пользователей по до «газпромнефть-хантос»,2
бк   ложная   проблемой отправки писем с почты  см прил,3
бк ограничение доступа исключение пользователей ннг эра-бурение смб,2
эра бурение - блок буровых растворов не отображается  просьба проконсультировать пользователя по некорректному отображению ролей в личном кабинете экосистемы брд,2
эра кс  прошу предоставить данные по уз  nuriev@profftech ru,3
маркетплейс   ошибка   ао евракор ошибка  не могу загрузить фото  а также не выбирается ответственное лицо,2
бк   консультация   поступила заявка в работу но при переходе в экосистему брд не могу найти данную заявку  подскажите пожалуйста с чем это связано,2
бк   дубликат   подключение сотрудников ооо везерфорд к системе ис эра бурение №32741 barsukov roman №32724 стихин дмитрий анатольевич куратор  халимов ринат рафаилович,1
бк   консультация   заполнение программы бурения в эра  бурение,2
список новых сотрудников в службе супервайзинга  прошу уточнить есть ли доступ у следующих сотрудников к смб 2 0 для объектов ннг,1
витрина вызовов подписка взаимодействие с внешним подрядчиком  подскажите  пожалуйста как можно направить внешнему агенту ссылку на нашу витрину вызовов,3
тех авангард   консультация   вопросы по вызову 801  оставил вопросы в комментариях к тех  вызову 801  цдмз претендент  в сервисе данные вопросы не зафиксировались  кспд авангард фа …,2
прошу создать учетную запись в экосистеме брд для дальнейшего получения ролей 09 07 24 заполнил заявку на https   upstream gazprom-neft ru   ответного сообщения о положительном согласовании не получил,2
бк   регистрация организации   регистрация ооо цдпо  прошу повторно направить компанию на регистрацию для витрины вызовов либо указать причину отказа  компания является членом-участником ассоциации «нефтегазовый кластер»  анк,2
бк   регистрация организации   регистрация «термо топ тюмень»  прошу повторно направить компанию «термо топ тюмень» на регистрацию для витрины вызовов,2
бк регистрация прод   airlogic   согласовтаь заявку  просьба взять в работу задачу  https   task gazprom-neft local browse onbesysbrd-417,3
коллеги подскажите статус обращения  прошу включить гпн-ито в орг объем витрины вызовов запрос во вложении,2
сброс qr кода,2
бк корректировка в ауз подготовка ролей к пст пассажирский транспорт uat  произошла ошибка с моей стороны я изменил регистр и написал ss_mechanic_test_zpl когда должно быть ss_mechanic-test-zpl прошу повторно изменить добавить роль,3
bid   доработка   газпром бизнес id  l3   № bs-00217  указание идентификационных данных инициаторов заявок,2
переключение 0 2 6 топливо  на проде конкретно с «тип работ» полем ошибки тоже нет  на юат уже больше недели 403 в связи с предстоящим пси эта проблема блокирующая,3
восстановление доступа для работы в сервисе эра- бурение,1
bid   консультация   газпром бизнес id  № bs-00214  пароль не соответствует требованиям безопасности,2
бк регистрация просьба согласовать заявку на доступ к тестовому сегменту экосистемы брд для пользователя друзь денис петрович email druzden1@gmail com  ссылка на тестовый сегмент  экосистема брд  gazprom-neft local,1
регистрация в экосистеме  я уже зарегистрирован в экосистеме и подписан на смб 2 0 на эл  почту  ahmetsafin alik@yandex ru,2
о подключении к брд ооо «гпн - развитие» работников ао стнг,2
bid   пароль   газпром бизнес id  l3   № bs-00213  ошибка при сбросе пароля при попытке сбросить пароль для логина p goncharov@isource ru приходит письмо ссылка при переходе ввожу два новых пароля и получаю такую ошибку  скриншот во вложении,2
при выполнении входа в эра кс вход не осуществляется,1
в эра-бурение в мониторинге гти не корректно отображается информация по режимным параметрам  прошу разобраться в причинах и устранить проблему,2
fw  топливо ошибки пользователя на проде,2
переключение 0 2 6 топливо на проде конкретно с «тип работ» полем ошибки тоже нет  на юат уже больше недели 403 в связи с предстоящим пси эта проблема блокирующая,3
бк консультация прошу предоставить данные об уз gebekov@sibitek com для дальнейшего определения доступа к данным,2
бк консультация предоставленная ссылка не открывается может есть другой способ отслеживания или другая ссылка,3
сервис эра-бурение регистрация уз регистрация эра бурения  коллеги уточните пожалуйста в на текущий момент статус заявок от сурначева антона и и нурнияза асхаровича  ранее была информация что должен согласовать тапаев азамат от сбм,1
сервис эра-бурение регистрация уз регистрация эра бурения  технолог сурначев антон technologist@krs scsbm ru заявка на регистрацию подана 26 06 24 жду согласования для дальнейшей работы в программе,1
сервис эра-бурение консультация заполнение пб в эра  бурение_унгкм_1-95_1696  посмотрите данные учетные записи  ермолаев антон и быков евгений  в чем причина ошибок  скриншот ниже в письме,1
сервис эра-бурение регистрация учётной записи регистрация эра бурения  заявка на регистрацию №33005 согласована,3
bid   пароль   газпром бизнес id  l3   № bs-00202  ошибка при восстановлении пароля при восстановлении пароля возникает ошибка  скриншот во вложении  уз  senadzor@yandex ru просим помочь с решением вопроса,1
bid   исправление интерфейса   газпром бизнес id  l3   № bs-00205  обновление пользовательских документов в лк,2
bid   ошибка   газпром бизнес id  l3   № bs-00189  дублирование заявки,2
эра-бурение подписка некорректная работа сервиса экоситемы блока разведки и добычи,1
для пользователя ильиных кристина александровна  ilinykh ka@tomsk gazprom-neft ru   необходимо проверить наличие учетной записи и при необходимости создать в cradle  hub isource,2
коллеги провели тестирование загрузки лендинга бизнес id а также перехода в зону регистрации в режиме «инкогнито» получили результат скорость = 13 секунд обоснованно считают этот факт ухудшением пользовательского опыта,3
при входе в эра бурение через браузер на учетку susloveo и karahanovshya выпадает ошибка ниже,1
витрина технологических вызовов  подскажите дальнейший путь до витрины технологических вызовов  прошло несколько дней - картина не меняется  скрин-шот ниже,2
выяснилась ошибка синхронизации,1
регистрация в экосистеме брд  подписка на сервис эра-бурение,2
коллеги уточните пожалуйста статус заявок ниже  сотрудники быков ермолаев компания акрос буровые растворы   коллеги из акроса вам потребуется после ободрения заявок зайти в эра бурение для того чтобы вы появились в команде и вас можно,2
подскажите как нам получить доступ к сервису эра-бурения на ооо газпромнефть-заполярье,2
бк   консультация   коллеги на какой стадии вопрос с подключением к ис эра бурение подрядчика везерфорд требуется оперативное решение вопроса в рамках задачи по заполнению программ бурения по планируемым скважинам,1
заполнение пб в эра  бурение_унгкм_2095_10034 сообщите пожалуйста статус заявки,3
запросила роль «эра-бурение базовый  подрядчик  – заполярье» заявка на согласовании  сообщите пожалуйста статус заявки,2
коллеги направьте пожалуйста список кураторов всех по кто согласовывает роли для их сотрудников  требуется для оперативности согласованя заявок,3
коллеги прошу согласовать заявку на регистрацию в лк экобрд подробности в задаче  https   task gazprom-neft local browse onbesysbrd-417,2
коллеги выгрузите пожалуйста актуальный список уникальных пользователей с подпиской на эра кс,2
смена привязанного номера телефона  подскажите пожалуйста как сменить номер телефона для доступа в кабинет эры бурения,3
просьба добавить организацию в список пользователей экосистемы ,2
коллеги при выборе команды в эра бурение не работает фильтрация по компании  в списке пользователи из других компаний и даже других сервисов  ниже в списке долота и растворы   провьба проверить и исправить ,2
коллеги не вижу вас в списке зарегистрированных лиц  проверьте доступ направьте скриншот куда вы заходите и с какой учетной записи  коллеги с технической поддержки подскажите пожалуйста статус заявок данных пользователей,2
в конструкции скважины неактивна галочка «спуск ок»  просьба проверить работу!,2
у пользователя возникает ошибка при работе в экосистеме в кспд прошу помочь  ранее подавались обращения но проблема не решена   о результате решения прошу сообщить мне,1
проверили все уз  не работает только одна thag-init_req-t_1 iqdwerv m_wrgu22 upy pb> meogk - не логинится ни в бк ни в тех  авангарде пишет что неверный пароль или логин  скрин прилагаю,3
после смены телефона не могу пройти двухэтапную аутентификацию для входа в экосистему брд,1
скзс выгрузка прошу направить выгрузку по пользователям экосистемы в течении дня,3
бк   консультация   проверьте учетную запись сотрудника компании ццс - кухаренко егор игоревич  ранее заявку подавал какой ее статус,2
сервис эра-бурение ошибка уточните по ошибке ниже почему попов александр николаевич не может согласовать программу  насколько на это влияет срок согласования и пишет что не успел,2
вчера по ошибке удален аккаунт в приложении яндекс ключ  сегодня войти не получается  прошу вас направить инструкцию как настроить яндекс ключ — или qr код,1
fw  экобрд  цд срр   не отображается кнопка перейти к сервису  просьба взять в работу задачу  https   task gazprom-neft local browse onbesysbrd-411  ранее у проекта отображалась подписка на сервис теперь нет,3
fw  экобрд   цд срр   запрос на консультацию  среда  прод проект  цд срр просьба взять в работу задачу  https   task gazprom-neft local browse onbesysbrd-412 просьба проконсультировать в вопросе который находится в задаче,3
скзс дубликат fw  экобрд   скзс   согласовать заявки  отправляю задачу  https   task gazprom-neft local browse onbesysbrd-413,2
бк регистрация прошу подтвердить заявку на регистрацию №32976  ташева дарья юрьевна ооо «газсерф»  и уведомить пользователя о согласовании заявки,2
скзс подписка согласовать заявки  варм не работает к сожалению не смогу создать задачу  просьба согласовать заявки  №74375 - ломовцева №74377 - захаров №74376 - потудинский среда  прод,2
прошел регистрацию на платформе сообщение о подтверждении не приходило  попробовал создать еще раз личный кабинет пишет что уже зарегистрирован или в обработке  попробовал войти не получилось попробовал восстановить пароль выдает такую ошибку,1
бк ограничение доступа прошу отозвать подписку на сервис эра-бурение у перечисленных пользователей по ао «мессояханефтегаз»  инициатором прошу указать армашкина дмитрия алексеевича и проинформировать его о результатах исполнения заявки,2
не логинятся в бк учетки – тех авангард витрина вызовов прошу подключиться к проблеме так как инструмент невозможно проверить срок действия уз только что обновили,3
маркетплейс подписка прошу согласовать заявки 74379,2
bid   дубликат   газпром бизнес id  l3   № bs-00202  ошибка при восстановлении пароля при восстановлении пароля возникает ошибка  скриншот во вложении  уз  senadzor@yandex ru просим помочь с решением вопроса,2
прошу согласовать заявку на регистрацию  почему процесс подвис,2
при согласовании иб  подписок на сервисы сталкнулся с ошибкой   во вложении файл с текстами ошибок,2
доступ к смб  на кп № 1 скв  № 3 павловского м-я не работает смб  подрядчики не могут вносить данные по скважине  судя по всему недостаточно ролей у учетной записи  нужно исправить ошибки  на фото выделено красной линией,1
цп пб консультация согласование роли  среда  uat сегмент  цдмз просьба взять в работу задачу  https   task gazprom-neft local browse onbesysbrd-390  описание в задаче джире,3
бк консультация просьба взять в работу задачу  https   task gazprom-neft local browse onbesysbrd-411  ранее у проекта отображалась подписка на сервис теперь нет  подробная информация в задаче  411,3
проблема при входе в эко систему  эко система доступна но есть проблемы при заполнении программы на бурения в сервисе эра-бурения,2
прошу направить информацию по пользователям систем пр 4 в экосистеме с указанием фио наименования подрядной организации и наличие подписок к дочернему обществу,2
обращение пользователя витрина вызовов  получилось перезайти но все равно не открывается,2
газпром бизнес id  l3   № bs-00184  uat cradle-essentials 503 ошибка с целью предоставления обратной связи инициатору просьба подсказать ориентировочные сроки выполнения обращения и причину нарушения сроков,3
газпром бизнес id  l3   № bs-00194  обновить базовый образ  с целью предоставления обратной связи инициатору просьба подсказать ориентировочные сроки выполнения обращения,3
с целью предоставления обратной связи инициатору просьба подсказать ориентировочные сроки выполнения обращения,3
двухэтапная аутентификация в экосистеме брд,1
